subreddit,id,timestamp,permalink,tag,title,body,comments,score
gaming,t3_1d35fta,1716963638.0,/r/gaming/comments/1d35fta/rarestlowest_drop_rate_for_an_item_or_equipment/,,Rarest/Lowest Drop Rate for an item or equipment you’ve gotten/attempted,"In the past, it's for the Monster Hunter games. And a few of the portable Castlevania games.

Recently, Persona 3 Reload for this crafting item that you can only get in these RNG doors with an abysmal RNG treasure chests. And you need a bunch of them. They're also time limited due to the nature of the game. ",105,43
gaming,t3_1d355cu,1716962411.0,/r/gaming/comments/1d355cu/what_are_you_playing_wednesday/,Weekly Play Thread,What are you playing Wednesday!,"What game's got your attention this week? What's great about it? What sucks? Tell us all about it! 

&#x200B;

 This thread is posted weekly on Wednesdays (adjustments made as needed).",120,17
gaming,t3_1d35357,1716962156.0,/r/gaming/comments/1d35357/skyrim_se_or_ac_unity_what_to_buy/,,"Skyrim SE or AC unity, what to buy?","Hi, so i have saved up just enough steam credits by selling cards and stuff to buy either skyrim SE or assassins creed unity, both are same price. But i  am having a hard time deciding on which one to buy, i am a big fan if both bethasda open world games and the assassins creed series, pls help me pick.

Edit: Thanks for all ur suggestions guys, i will buy skyrim as of now, will try to snipe unity in later on sales maybe : )",37,0
gaming,t3_1d34gz1,1716959674.0,/r/gaming/comments/1d34gz1/what_are_some_famous_game_quotes_that_you_know_of/,,What are some famous game quotes that you know of?,For example 'Do a barrel roll' from Star Fox.,122,0
gaming,t3_1d34gqu,1716959647.0,/r/gaming/comments/1d34gqu/save_feature_in_far_cry_3/,,Save feature in far cry 3,"I was playing far cry 3 its an amazing game, with excellent story and game mechanics. But i noticed whenever i reload or continue the game i get back to the nearest save house and all my progress is saved. But i want to start from the same specific location where I was when left the game because sometimes I'm exploring the map and i have to leave the game and when i get back i have to go there again. I want to ask is there any way i can save the game where i want? ",8,0
gaming,t3_1d34cj9,1716959192.0,/r/gaming/comments/1d34cj9/multiplayer_games_and_player_culture/,,Multiplayer games and Player Culture,"So I've realized that one of the reasons I havent been enjoying multiplayer competitive games is the player culture. What is that? Well, I'll explain by example. Using Smash Bros, Dead by Daylight, and Tony Hawk Underground Pro.

Case 1: Smash Bros

As a long time fighting game player, I've always ran into an issue where I get to a point where there's no one I know who's fun to play with, they're either too good, or too bad. When I happened upon Smash as a kid, it was like a prayer being solved. The chaos of Smash ensured that skill gaps were less severe. 

Eventually, the competitive Smash community became the most prevalent group of Smash players. Nowadays, I'm looked at as if I have brain damage if I want to play with items on. Most players don't even want to play on 90% of stages available in game, because they aren't close enough to Battlefield or Final Destination. Getting a group of friends to want to play 4 player free-for-all is a struggle even. Everyone would rather play 1v1 no items, 2:30, because that's how the competitive scene does it. I venture to guess its the same for many of you.

 To me, this is ridiculous, why order a burger just to take off all the toppings? Of course, that's also a solved issue now. Due to the prevalence of the competitive scene, developers are finally earnestly trying to make platform fighters(a genre delineation that pretty much didnt exist for the first 15 years of smash's life, and btw, Shrek Super Slam is a Power Stone clone, not a Smash Bros. one), though pretty much only Rivals of Aether and Brawlhalla are relevant.

Either way, the point im making here still stands, Smash Bros. current player culture is no longer interested in the original selling point of the franchise.

Case 2: Dead By Daylight

This is more about the genre as a whole, for those who don't know Dead by Daylight is an asymmetric multiplayer game where theres 1 killer, and 4 survivors. Pretty much every other game in this genre is a horror game, so they all have similar culture. 

In DBD, you'll often hear one player type complaining about the behavior of the other, and what actions are 'kosher' in gameplay. Killers are often expected to give player's the hatch, and of course, its a game where there's an objective benefit to camping. You can also choose to intentionally leave survivors downed, instead of putting them on a hook(effectively an altar you put someone on to cash out a kill), this is called slugging. as you can imagine its possible for a Killer to leave most players downed and just harass the living player around the map. On the flipside, Survivors can equip items to inhibit the Killer, whether it be a blinding flashlight, the ability to negate fall damage or quick heals. Both parties can do obnoxious actions to each other. Another odd trend of the player culture is survivors will just...wait...at the exit gate just to troll the killer and force them to be in the game longer, they may even make sure to tank some hits from the killer if they know the killer's ability isnt useful enough to stop them.

This results in a player culture where a ""good"" match is the one where both teams have to have a certain amount of charity to their actions, rather than just doing the most efficient actions to win. Seriously. Just go over to r/deadbydaylight and type '4K,' you'll get 100s of posts complaining about how the Killer's dedication to a swift victory is annoying.

Case 3: Tony Hawk's Underground Pro

This is a mod for THUG that returns the online features. The online features many of the game's single player content, just with the ability to score attack or time attack them with a lobby of people. The most popular being standard score attack. 2 minutes, get the highest score. There's just one issue. Anyone who's played enough Tony Hawk knows that if you're still in a combo when the timer hits 0, the run is still active. 

Why is that a problem? Well, there is ONE domineering goal for the THUGPro community - Billing. Billing is the idea of playing to score a billion points. With the aforementioned timerstop - really only the last second of a Trick Attack run matters. It determines what you're doing with the next 5 minutes of your life. Either you are also attempting to Bill, going around the entire map doing an infinitely long combo, or you're combo was already over. Meaning you are now stuck waiting for the last currently active combo to end before the game mode ends. I've seriously been in lobbies where there was a single guy comboing for 10+ minutes while our only option was to leave lobby or wait.

  
Summary:

 In each one of these cases, there's a completely different idea of what ""the right way to play"" is. The Smash community is concerned with a competitive ruleset, where chaos is pretty much eliminates any chance outside of character specific mechanics. DBD is concerned with maximizing fun for both parties, essentially using an honor system to eliminate the use of ""cheap"" tactics. And THUGPro epitomizes obsessiveness, since there's no direct player interaction, THUGPro players act as if there ARE no other players, despite the fact that the other players are restricted during play.

If you are like me, and find yourself bored and or miserable in a multiplayer game's landscape, despite liking the game mechanically. Keep the player culture in mind, personally, I'd honestly avoid MOST team based games, as it often just allows other players to blame  each other for losses and mistakes. I'd also avoid games that have released more than 10 years prior to your first time playing, as they're often filled with very...anti-newbie players.

Are there any games you've played where the player culture ruined or enhanced it? I'm curious what the landscape is like as someone who plays very few of them now",17,0
gaming,t3_1d34b5l,1716959045.0,/r/gaming/comments/1d34b5l/how_much_do_you_consider_a_normal_amount_to_spend/,,How much do you consider a normal amount to spend on videogaming per month? (outside of hardware),"I remember years and years ago WoW was considered pretty expensive at $15ish/month.  But now that doesn't seem to be an issue.  I know its common to buy new games every month.  And I know people spend a ton on games that have transactions, though that seems pretty frowned upon.  And some games are like hundreds of dollars to get all the expansions.  

So what would you consider a chill amount to spend on gaming personally per month?  How about on a single game per month?  Would that even be a different number for you?

Edit: ""its subjective"".  Yes, I know. The question is worded as ""you personally"" and ""for you"".  I want to hear what members of this community do because I am curious what different people do.",8,2
gaming,t3_1d347wj,1716958732.0,/r/gaming/comments/1d347wj/couch_coop_recommendations/,,Couch Co-Op Recommendations,"I'm looking for some game recommendations to play with my partner on PS5. Her and I played through all of Overcooked 1 & 2 and their DLCs, and would like to find something new to play which is similar.

Any help or recommendations would be greatly appreciated. Thank you ❤️",28,7
gaming,t3_1d344ci,1716958361.0,/r/gaming/comments/1d344ci/are_there_any_videos_games_that_feature_or_take/,,Are there any videos games that feature or take place in upstate New York?,Just curious. It's where I grew up. Specifically the Hudson Valley / Catskills area. It's a really beautiful scenic area and I wouldn't be surprised if it's been featured in a historical game or something. Especially being so close to New York City which has been done dozens of times.,35,5
gaming,t3_1d34471,1716958347.0,/r/gaming/comments/1d34471/im_in_tears_and_its_delightful/,,"I'm in tears, and it's delightful. ","What I'm going to describe now is something a lot of you maybe won't understand or think it's silly, but it's something real for me, and the reason I'll forever remember chants of sennaar as a game.

Since childhood I've always been fascinated with videogames, but I live in a third world country that unfortunately taxes everything through the roof.

So it is really hard to be able to enter this world for real here, just like thousands I've grown up watching others play on the internet cause it was the closest thing that little me had to be able to enjoy the games he loved so much.

Fast forward to nowadays, I got my Xbox one 2 months ago and took one month for me to begin signing gamepass, and in gamepass I found chants of sennaar never having heard of it and after reading the description it gained my interest and I downloaded it. 

Today at exactly 01:37 AM I managed to finish the game's true ending, the first time that I finish a game myself, not watching others play it and a game I found myself too.

I know it might sound ridiculous that me currently at 19 y old is crying because of a videogame that doesn't even have a sad ending. 

But idk what to say honestly, how do explain this feeling? I don't even know why I decided to post this.

I just feel so happy...really happy.

Things have not been easy recently, looking for a job, looking into college options, having to support my small brother through the divorce of my parents, and all of that without most my friends since (I live in a pretty countryside town and my school was in another town).

But even tho things might not been easy, atleast today the nerd child inside my heart has the satisfaction to see that it can finally seek solace in the hobbie it loved so much.

Anyways, that's my motive why I think this game will probably stick to my memory like bubblegum.

If you're getting in the game now or anytime soon relish every single moment, you have a wonderful journey ahead.

And if you find myself in the same situation I grew up in, Bright up! One day you'll reach that which you desire so much.

Be safe out there.",50,296
gaming,t3_1d33xu2,1716957684.0,/r/gaming/comments/1d33xu2/any_games_for_20_or_below/,,Any games for 20$ or below?,I know I recently posted here earlier but I managed to get a hold of some cash and am wondering if any good games are out there more at most 20$. Ive been thinking about getting the game Bully for 9$.,48,0
gaming,t3_1d32v6z,1716953947.0,/r/gaming/comments/1d32v6z/great_pc_game_to_play_when_drinking/,,Great PC Game to Play When Drinking,What's a great game when you've been imbibing all night?...what sort of person are you?!  You going to play solitare?...Fallout?...Horizon Zero Dawn?  Where's  your happy place when you've had a few too many  and decide to game?,53,0
gaming,t3_1d32otg,1716953364.0,/r/gaming/comments/1d32otg/what_game_has_the_most_ridiculous_skins/,,What game has the most ridiculous skins?,"I just picked up Smite again and good lord these skins are hilarious.

You can turn a giant worm into a walking meatball sub and have him fighting Powdered Toast Man while a literal Runescape character duels with Uncle Iroh only to be ganked by Nicol Bolas and Megatron while being supported by a flying pool noodle and Cthulhu drawn as a Looney Toons character.  Meanwhile, Bob Ross and a Demogorgon farm the jungle.

It's pure madness and I love it.

So what games in your opinion have the most insane skins?",217,616
gaming,t3_1d31fde,1716949302.0,/r/gaming/comments/1d31fde/what_are_some_games_you_can_leave_on_autopilot/,,what are some games you can leave on autopilot that are nice to watch. ,"I'm looking for something to run on a spare monitor. Closest thing to what I'm looming for is Neptune's pride. I also remember (name lost), this older idle game where you ran a town and sent out adventurers but I ended up 100% clearing it and the successor became a victim of unfavorable monetization. 

Ideal list:
Long tic cycle. 


Managerial/SIM (doesn't have to be 4x). 


Aesthetically appealing enough to be on a display. 


More than ""just an incrementer"" as in a game to play or micromanage that is more than i++ but will have pacing (factorio is too involved) 


<$40 USD


MUDs and single player TUI games are okay 

thematically relevant:
I used to have Salty Bet running on a monitor, and recalled gambling my holloween candy on Smash Bros NPC fights. Something where npc  competitors can be established but otherwise operate independantly over a period of time for my amusement would be 😙 🤌

edit : also having an AI play a game for my amusement promethean style would be neat. 

Looking forward to what yall got. ",89,15
gaming,t3_1d30f5c,1716946163.0,/r/gaming/comments/1d30f5c/open_world_fantasy_recommendations/,,Open world fantasy recommendations ,"I mainly just play open world fantasy games these days but I need some need recommendations. Played the shit out of Skyrim, Elden Ring, Witcher 3, Dragon Age Inquisition, among others but looking for something new. Things like final fantasy and baldurs gate really don’t interest me. Not looking for turn based combat, top down cameras, or super dated games like Morrowind. Basically something to hold me over while I wait god knows how many years for the elder scrolls 6 😂",59,12
gaming,t3_1d307qg,1716945537.0,/r/gaming/comments/1d307qg/the_ultimate_showdown_of_ultimately_ruinous/,,The Ultimate Showdown Of Ultimately Ruinous Crossover Cash-ins (The Jimquisition),,6,0
gaming,t3_1d301kj,1716945015.0,/r/gaming/comments/1d301kj/hellblade_2_can_be_slow_but_wow_is_it_a_visually/,,"Hellblade 2 can be slow, but wow is it a visually striking & beautiful game. ",,45,0
gaming,t3_1d2zvkf,1716944524.0,/r/gaming/comments/1d2zvkf/ama_hi_we_are_pathea_games_developers_of_my_time/,,"[AMA] Hi, we are Pathea Games, developers of My time at Sandrock. V1.3 free update and the new Pet DLC is available right now, come and ask anything!","**Thank you all for your participation. We're now returning to work, focusing on polishing our current projects and developing new ones. We'll also check in periodically to ensure we don't miss any questions. Cheers!**

**----Edit----**

Hello  r/gaming!

*About My Time at Sandrock (*[*steam page*](https://store.steampowered.com/app/1084600/_/)*):*

It's a game you, as a new builder, arrive in the wild and rugged city-state, where it's up to you and your trusty tools to restore the community to its former glory. Gather resources to build machines, befriend locals, and defend Sandrock from monsters — all while saving the town from economic ruin. Check game trailer [here](https://www.youtube.com/watch?v=zz4SkhVp8TQ).

Now V1.3 is available on all platforms, we invite you all to dive into the fun and excitement of discovering and nurturing monsters in Sandrock. From the windswept desert to the white salt plains, from the echoing canyons to the towering mountain peaks, new adventures await you! Check what's new [here](https://www.youtube.com/watch?v=lWCHaM_QZiA).

https://preview.redd.it/ykf45ohnk93d1.png?width=800&format=png&auto=webp&s=28aff92c9a236fc0f75e837372207a8a407ff793

*About us:*

Pathea Games was founded by 10 passionate young individuals. In the beginning, we faced financial constraints and had to operate out of a residential building. It's a honor that our work has been well-received by players. And now we have **My Time at Sandrock, My Time at Portia, Let's School** and many interesting games.

You can visit our [Twitter](https://twitter.com/MTaSandrock), [Discord](https://discord.gg/dZAQjFp), and [Reddit](https://www.reddit.com/r/MyTimeAtSandrock/) channels for more in-game information. But now is the perfect chance to get answers directly from the team. Ask us anything about My Time at Sandrock or whatever you'd like. Let's heat up the discussion!

*Participants：*

Director: Zhi Xu

Senior Writer: David Peck

Art Design Lead: Long Tang

[Proof](https://x.com/MTaSandrock/status/1793628232186470693)",57,112
gaming,t3_1d2xo0q,1716938251.0,/r/gaming/comments/1d2xo0q/suggest_good_coop_games_min_3_players/,,Suggest good co-op games (min 3 players),"As the title, co-op games with at least 3 players. The only co-op game we could find fun to play in co-op was Nioh 2. Thanks in advance for any suggetions!",55,8
gaming,t3_1d2xl8p,1716938048.0,/r/gaming/comments/1d2xl8p/anyone_know_of_a_game_like/,,🤔 anyone know of a game like...?,"Like diablo/last epoch/grimdawn for the loot and battle/world exploration, but the art style like soulstone survivors? ",34,0
gaming,t3_1d2wnyo,1716935607.0,/r/gaming/comments/1d2wnyo/mario_64_end_boss_gripe_yes_its_me_again/,,"Mario 64 end boss gripe (yes, it's me again)","Hi all.

So, I hang my head in shame a bit. I come back here with my head slung low (probably from the sheer weight of negative comments 🤣🤣🤣) 

So, I've just put on SM64 and, guess what? I beat Bowser in mere seconds. Turns out it wasn't that hard....

...

Ok, sod ya! It wasn't even remotely difficult!!!!

All joking aside, do you ever get that where you struggle smd swear and grit your teeth only to quit the game, come back a day or two later and just absolutely ace the troublesome part? It certainly makes my confidence dip a bit. 

Thing is, I love gaming. I'm not great at it, but I do enjoy it. I enjoy the stories, the worlds, the combat systems and puzzles. But, same as anything, every now and then it frustrates me to the point of just wanting a moan.

Anyway. Thanks for reading. Game on",24,0
gaming,t3_1d2wnps,1716935589.0,/r/gaming/comments/1d2wnps/girls_caught_crabs_trails_of_cold_steel_3/,,Girls caught crabs... (Trails of Cold Steel 3),,9,0
gaming,t3_1d2wae9,1716934638.0,/r/gaming/comments/1d2wae9/bethesdas_great_one/,,Bethesda's great one,,40,497
gaming,t3_1d2vo6w,1716933070.0,/r/gaming/comments/1d2vo6w/is_the_darksouls_1_remaster_worth_goodworth/,,Is the Darksouls 1 remaster worth good/worth playing?,"For context: I've played DS3 and Elden Ring, so I have a good understanding of Souls games.

Is this DS1 remastered fun for someone that never played it when it first came out? How are the controls? Good armor and weapons? Etc 

It's $40 and I'm trying to decide if I should buy that or just another game.

Thanks!",84,0
gaming,t3_1d2vm91,1716932935.0,/r/gaming/comments/1d2vm91/the_best_thing_about_lower_end_p2w_phone_games/,,The best thing about lower end P2W phone games.,"I can’t lie I occasionally get lost in shitty phone games, my favorite ones like alien invasion that have a monthly subscription instead of buying the game outright for $1.99 have an exploit that has been popular since Fable 1 and 2 days, why buy currency when you can set up a farm to your liking then manipulate the system clock/calendar to fast forward the money gain? I get a little dopamine boost when I find out the game has that cause it takes me to the Fable 2 days of becoming a billionaire in 6 cycles.",9,0
gaming,t3_1d2vjn4,1716932749.0,/r/gaming/comments/1d2vjn4/whats_your_favourite_voice_acting_in_gaming/,,What's your favourite voice acting in gaming?,"As title...

Inspired by Martin Sheen as the Illusive Man in Mass Effect. He does a brilliant job, charismatic, smooth, yet cold and calculating.",48,2
gaming,t3_1d2vjms,1716932748.0,/r/gaming/comments/1d2vjms/if_you_like_card_games_check_out_the_kickstarter/,,"If you like card games, check out the Kickstarter for Chrono","It's being developed by former pro Legends of Runeterra players, so it plays a lot like LoR, but it also borrows a few mechanics from MTG. It also has a few completely new twists on the genre, like every maindeckable unit being able to level up and switching to different timelines with unique effects.

[https://www.kickstarter.com/projects/chronoccg/chrono-ccg/description](https://www.kickstarter.com/projects/chronoccg/chrono-ccg/description)

I'm not a developer. I'm just excited to play this.",3,0
gaming,t3_1d2ug5v,1716930042.0,/r/gaming/comments/1d2ug5v/missions_like_this_in_mobile_games_should_be/,,"""Missions"" like this in mobile games should be illegal.",,409,7044
gaming,t3_1d2uakm,1716929666.0,/r/gaming/comments/1d2uakm/best_doublejump_in_gaming/,,Best double-jump in gaming?,Wich is the most delicious and satisfying double-jump in any game for you?,1111,905
gaming,t3_1d2tr3s,1716928359.0,/r/gaming/comments/1d2tr3s/the_legend_of_zelda_majoras_mask/,,The Legend of Zelda: Majoras Mask,"Man idek where to really post this, but if you haven't tried the new majoras mask recompiler then you definitely should. Ive been looking for years for the best way to play n64 zeldas on PC. Ive tried all of the n64 emulators. Ive tried 3ds emulators with the 3ds remakes of the game. And ive tried dolphin with the collectors edition (this one up until now was the best) but holy fuck this new recompiler blows all of them out of the water. If you're looking for a way to relive majoras mask on PC then google ""majoras mask recompiler"" and click the github link. Its absolutely amazing. High FPS, high resolution, AA, and all the other good shit to truly enjoy one of the best zelda titles in high fps high resolution fantasticness. Thanks for listening to my ted talk. ",26,34
gaming,t3_1d2thda,1716927721.0,/r/gaming/comments/1d2thda/any_games_similar_to_plants_vs_zombies/,,Any games similar to Plants Vs Zombies?,"Yes, I know about Bloons.",23,21
gaming,t3_1d2t16z,1716926720.0,/r/gaming/comments/1d2t16z/ghostrunner_2_weird_question/,,Ghostrunner 2 weird question,Question: are there any mirrors that can be broken in this game and i KNOW it's a weird question but i have huge anxiety over mirrors due to it relating to my major fear of bad luck and please just bear with me and answer sincerely please or better yet are there any destructible objects in that game?,5,0
gaming,t3_1d2svht,1716926398.0,/r/gaming/comments/1d2svht/are_there_any_good_f2p_heck_even_p2w_games_that/,,"Are there any good f2p, heck even p2w games that you could recommend that are actually fun?",Tell me your darkest f2p and p2w game recommendations.,90,0
gaming,t3_1d2srfy,1716926135.0,/r/gaming/comments/1d2srfy/is_there_a_subreddit_specifically_for_showcasing/,,Is there a subreddit specifically for showcasing 100% completion on video games?,I’m looking for a place to share the video games I 100% complete. Thanks!,26,0
gaming,t3_1d2smux,1716925840.0,/r/gaming/comments/1d2smux/rainbow_six_siege_fans_roundly_boo_the/,,Rainbow Six Siege fans roundly boo the announcement of a new monthly subscription service,,953,16619
gaming,t3_1d2sgsn,1716925459.0,/r/gaming/comments/1d2sgsn/riot_games_have_announced_a_skin_package_for_over/,,Riot Games have announced a skin package for over $400 (you get 2 skins and some recolours but it's ultimately for the main Ahri skin)... Is this the ultimate micro-transaction? I'd guess it'll be time-gated as well to bank on FOMO.,,815,5381
