subreddit,id,timestamp,permalink,tag,title,body,comments,score
gaming,t3_1d7asfv,1717437330.0,/r/gaming/comments/1d7asfv/fanmade_fallout_2_firstperson_remake_now_has_over/,,"Fan-made Fallout 2 first-person remake now has over 100 developers working on it, and is targeting a Steam release while making 'fast progress'",,0,2
gaming,t3_1d791iu,1717433015.0,/r/gaming/comments/1d791iu/what_game_series_deserves_a_dunelotr_trilogy/,,What Game Series Deserves A Dune/LOTR Trilogy Treatment?,"Elden Ring, Imax, Beer and popcorn. It'd be the best dahm day",41,0
gaming,t3_1d77jic,1717429372.0,/r/gaming/comments/1d77jic/lan_games_for_ios_do_not_exist/,,LAN games for iOS do not exist?,"So me and some family members were messing around on our iPhones, comparing high scores in old games like subway surfers and temple run, when we started feeling competitive and figured we would destroy each other on asphalt 8. But no matter what we tried, making sure we were all on the same network with app permissions on, we couldn’t connect. I was pretty sure we had done this in the past. 

So, we decided to find some other free racing games with LAN capability, and eventually came up short. So we widened our search to any LAN games we could find. And what? There aren’t any at all? We of course can do regular online games like fight each other in call of duty Mobile, but it’s not really the same. 

Do you guys think there’s something we missed, whether it’s a LAN supported title or possibly settings we don’t know to toggle for this? Or that there’s actually no LAN connectivity support on IOS apps, and I simply misremembered? ",2,0
gaming,t3_1d77ato,1717428748.0,/r/gaming/comments/1d77ato/youre_expectations_for_the_upcoming_summer_game/,,You're expectations for the upcoming Summer Game Fest 2024...?,Summer Game Fest 🎮  ,32,0
gaming,t3_1d76vt5,1717427699.0,/r/gaming/comments/1d76vt5/which_video_game_has_the_greatest_shotgun_of_all/,,Which video game has the greatest shotgun of all time?,"Yep, I’m bringing this age old discussion back because I want everyone who reads this post to appreciate how fucking awesome shotguns are in video games.

If you’ve played a shooter, you’ve probably used a shotgun. Some are good. Some are bad. And some are **ABSOLUTELY AMAZING**.

So, I want to ask y’all what the best shotgun in gaming is.

Let’s not make it generalized too! If there’s a series with a certain awesome double barrel shotgun, you have to name a certain installment of the franchise, not the franchise as a whole. 

Doest have to be a “regular” shotgun either!! If it’s a long stick that shoots in a circular spread pattern, it’s fair game.

Can’t wait to see your answers!! Thanks in advance 
",1516,766
gaming,t3_1d76rnn,1717427401.0,/r/gaming/comments/1d76rnn/why_a_lot_of_rpgs_decide_that_minimalism_is_an/,,Why a lot of RPGs decide that minimalism is an improvement?,"Look, I am not saying that every RPG needs to be CRPG level, with like 70 different spells, abilities, scrolls, whatever.  
But there is this... shift, somewhere around 2005-2008ish where it just seems as if RPGs almost delights in reducing the amount of spells, meaningful stats and the like over time.  
Reducing depth.

I am just confused... why that is?  
I mean, is it to make the game easier?  
Because as someone who's first ""real"" RPG was dragon age Origins at the age of 12, and beat it without much of any issues...  
I can't really say that it seems as if depth =/= difficulty?

Or am I wrong here?  
Was it just someone who decided that less abilities / less potential for complexity meant the game would sell better?

(and I just want to emphasise, I am not saying all RPGS need to be like this, or that they should all be super mega difficult, I am not an elitist in that way. I am just... confused? Especially as a lot of franchises, even if they start with a lot of depth tend to reduce it over time, and I am still trying to fully rationalize why that is)",157,97
gaming,t3_1d76kd9,1717426900.0,/r/gaming/comments/1d76kd9/what_game_scene_really_moved_you_so_much/,,What game scene really moved you so much,"I’ll start, the ending of Starfield really just put me in perspective of how everyone and everything in the universe we live in is all connected.",34,0
gaming,t3_1d76bt6,1717426286.0,/r/gaming/comments/1d76bt6/are_there_a_lot_more_demons_in_the_two_doom/,,Are there a lot more demons in the two Doom Eternal dlc?,"I started the first dlc today and there was an interesting quote at the difficulty selecting menu, something like ""just with more demons because its a dlc"". And than I played at around 1 hour on the first map and imo I killed as many demons as I killed in the main story's 2 or 3 maps. Is that will be the way of these dlc, really that lot more demons?",16,0
gaming,t3_1d75iod,1717424207.0,/r/gaming/comments/1d75iod/riven_official_launch_trailer_available_june_25th/,,Riven | Official Launch Trailer | Available June 25th | 4k,,56,192
gaming,t3_1d75d40,1717423799.0,/r/gaming/comments/1d75d40/are_the_rich_actively_trying_to_ruin_the_video/,,Are the rich actively trying to ruin the video game industry because of gamers holding GameStop shares.,"I did some research about the whole GameStop fiasco and hypothesized that the main reason all these big name companies are going to crap is because the super rich is losing millions and possibly billions due to gamers and activists buying and holding GameStop stock and seeing how all the big name companies with very wealthy shareholders are being run into the ground there may be a connection and that would explain a lot about the state of the gaming industry right now, I’ll leave the rest for interpretation. ",113,0
gaming,t3_1d75bnt,1717423692.0,/r/gaming/comments/1d75bnt/playstation_vr2_players_can_access_games_on_pc/,,"PlayStation VR2 players can access games on PC with adapter starting on August 7. Yes, it's SteamVR compatible.",,42,75
gaming,t3_1d7590k,1717423505.0,/r/gaming/comments/1d7590k/hellblade_2_very_coolcreepy_image_i_captured_in/,,[Hellblade 2] Very cool/creepy image I captured in Photo Mode,,14,53
gaming,t3_1d73lhd,1717418919.0,/r/gaming/comments/1d73lhd/should_i_give_up_on_ghost_of_tsushima_dlc/,,Should I give up on Ghost Of Tsushima DLC?,"Loved and finished the main game, I was happy to get more content with the Iki Island DLC, but after a few hours of playthrough I'm really not liking how they handled the difficulty spike. Enemies are just way more tanky, which breaks the illusion of actually having a sword duel, as I need to slash/stab an enemy so many times before killing it ( I have all the stances upgrades and sword upgrades). I wish they were just more skilled rather than becoming bullet-sponges.

I find interesting that they can switch weapons on the fly, but because of how long they take to die, it feels more like cycling through different phases until they die.

Any reason to continue at this point? Is the combat going to improve?",14,0
gaming,t3_1d73fcj,1717418402.0,/r/gaming/comments/1d73fcj/whats_your_opinion_on_procedural_generation_in/,,What’s your opinion on procedural generation in games?, Do you know some good games with it?,86,22
gaming,t3_1d733wg,1717417407.0,/r/gaming/comments/1d733wg/official_categorization_of_playstation_studios_by/,,Official Categorization of Playstation Studios by Sony [Infographic],"How do you feel about this categorization that Sony has done. I'm a bit relieved about Bend Studio falling under Evolving/Multi-Gere but also worried why it's not under Single-Player games. Days Gone was a single player game and if Sony has pushed Bend to make a multi-player title then another disappointing game (sales wise) may end up killing this studio.

Glad to see that Firesprite and Housemarque are focusing on single-player games.

What are your thoughts on this?



https://preview.redd.it/vot5t0yunc4d1.png?width=1697&format=png&auto=webp&s=ba2f46045e49480bf6e3e7419010b1df83b77f33

",30,26
gaming,t3_1d72qfg,1717416190.0,/r/gaming/comments/1d72qfg/whats_the_best_ww2_video_game_youve_ever_played/,,What’s the best WW2 video game you’ve ever played?,"Always been a big fan of World War 2 history, but when it’s come to video games over the years, I feel there’s a limited selection that really got it right or were really good. To name my personal favorites; Medal of Honor Frontline was the best in my opinion, and Return to Castle Wolfenstein may be more fantasy but it was a fun game from my childhood. 
EDIT: COD World at War too :)",817,426
gaming,t3_1d71idy,1717411831.0,/r/gaming/comments/1d71idy/naughty_dog_will_not_be_a_the_last_of_us_studio/,,"Naughty Dog Will Not be a The Last of Us Studio Forever, Says Neil Druckmann",,600,2998
gaming,t3_1d71h5u,1717411689.0,/r/gaming/comments/1d71h5u/hiroyuki_sanada_is_in_talks_for_a_role_in_the/,,Hiroyuki Sanada is in talks for a role in the live-action Ghost of Tsushima movie,,119,1649
gaming,t3_1d70gwp,1717407501.0,/r/gaming/comments/1d70gwp/cyberpunk_casino_i_made_in_minecraft/,,Cyberpunk Casino I made in Minecraft,,44,749
gaming,t3_1d6zrm9,1717404278.0,/r/gaming/comments/1d6zrm9/c_o_o_l/,,C o o l,,7,33
gaming,t3_1d6yxxu,1717400555.0,/r/gaming/comments/1d6yxxu/retro_games/,,Retro games,So recently I’ve played a retro Kirby game (Kirby and the amazing mirror) and I liked so much the style of retro games that I’m searching for more. What retro games y’all recommend (80s-20s)?,21,1
gaming,t3_1d6xif5,1717394416.0,/r/gaming/comments/1d6xif5/making_friends_monday_share_your_game_tags_here/,Weekly Friends Thread,Making Friends Monday! Share your game tags here!,"Use this post to look for new friends to game with! Share your gamer tag & platform, and meet new people! 

This thread is posted weekly on Mondays (adjustments made as needed).",2,1
gaming,t3_1d6x03f,1717392350.0,/r/gaming/comments/1d6x03f/game_suggestions_that_are_a_time_sink_but_not_a/,,"Game suggestions that are a time sink but not a ""priority"". ","Hey all so I feel I'm in the lull between games, which I'm sure most of you have experienced, where I don't really feel like playing anything and am looking for something new. 

To help with suggestions, I enjoy RPGs, MMOs, competitive pvp games like mobas, I like the rouge like games, souls likes, survival games sometimes etc.

Basically, I'll play just about anything that isn't too slow. Some big games that most people liked that I did not, include RDR2, the Witcher 3, and more recently, Starfield. 

If anyone has some ideas for games that are fun and engaging and can be a big time sink but not too sweaty or grindy (not looking for an MMO or moba right now) then I'd sincerely appreciate it. 

Currently considering Diablo 4 or Remnant 2 are either of these a good idea?",111,0
gaming,t3_1d6wv52,1717391821.0,/r/gaming/comments/1d6wv52/batman_arkham/,,Batman Arkham,"I was thinking about playing them one of these days, so I wanted to know if they’re actually worth getting into for someone who doesn’t even like Batman. Then I wanted to know what the right order was to play them, and the reason I came here is because when I looked it up it didn’t include Arkham Origins for someone reason, so I came here. Now you also might be wondering “if you don’t like Batman why would you want to play the Batman Arkham games?”
The reason is because I feel like if I were to play the games I’d find a new respect for Batman, as a character.",33,0
gaming,t3_1d6v1v6,1717385338.0,/r/gaming/comments/1d6v1v6/if_you_have_a_bioshock_itch_you_gotta_try/,,If you have a Bioshock itch you gotta try Deathloop,Got hooked this weekend playing Deathloop and it’s scratching my Bioshock itch pretty well. The game feels complicated at first but I love how it allows you to go back and explore stuff at your own pace. It also mixes a Souls-like death mechanic/PvP invasion that it’s pretty interesting for a FPS. I’ve never played any Arkane game before but I know gamers who have played Dishonored will feel right at home with the type of stealth/abilities gameplay. Just playing this game makes me want to have a Bioshock that isn’t linear and we can just go back to experience different scenarios and explore Rapture/Columbia without being punished for missables.,63,0
gaming,t3_1d6tlwa,1717380517.0,/r/gaming/comments/1d6tlwa/keep_coming_back_to_this_beautiful_game/,,keep coming back to this beautiful game,,98,0
gaming,t3_1d6s8od,1717376186.0,/r/gaming/comments/1d6s8od/recommended_games_with_hilarious_mods/,,Recommended Games with Hilarious Mods?,"Long-time console player here who relatively recently started PC gaming (too). I literally did my first modding ever just last night (minor QoL/visual fixes for Hellblade 2).

I know of the really popular games for modding like Skyrim, Fallout, anything Bethesda basically, and of course anything Valve like Half-Life, Garry's Mod, etc., but...

What are some maybe less known/popular games for funny modding? Like, maybe a serious game where you can give all the characters bobble heads, or swap out their limbs like Mr. McGreg, with a leg for an arm, and an arm for a leg? I'm not looking to ""cheat"" or get a *leg up* on anyone - I mainly just want to do something hilarious for laughs - so offline / single player games only please.

FWIW, my favorite games are ones like Dishonored, Prey, Control, Cyberpunk, Days Gone, Deus Ex, etc. I have a type, obviously, but I'm open to trying new things! 

TIA!

P.S. I think this is my first post in this community, so moderators please LMK if I did something wrong.",38,0
gaming,t3_1d6qqah,1717371551.0,/r/gaming/comments/1d6qqah/my_wiiva_unit_01/,,My Wii-va UNIT 01,"I bought a junk Wii for about $20 a few weeks ago. It really was a mess aesthetically, but they assured me it still worked.

It didn't have any of the plastic covers that protect the SD and the gamecube controls, it was quite dirty and scratched on what would be the upper part if you placed it horizontally.

Anyway, I decided it was a fair price for a new project. It's not finished yet, but I'm liking how it's turning out.

What do you think? Do you like the Eva 01 that I have engraved on the acrylic plate? I love the colors of the internal lighting.

Greetings from Argentina 🇦🇷♥",22,285
gaming,t3_1d6nvgp,1717363594.0,/r/gaming/comments/1d6nvgp/game_over_screen_from_the_mummy_returns_on_gbc/,,Game Over screen from The Mummy Returns on GBC,,85,2424
gaming,t3_1d6nsq2,1717363387.0,/r/gaming/comments/1d6nsq2/what_are_the_greatest_podcast_games/,,What are the greatest Podcast Games,"I need another great podcast game, the greatest podcast game of all time stays ""the binding of isaac"" for me. The game is easy to play feels very natural, so you are able to properly play it and listen to some podcast, but now I tried some other games and none do feel to work as well. 

What games are some great podcast games according to you. (Tried any PDX game, but they definetly didn't work)",61,0
gaming,t3_1d6n84z,1717361856.0,/r/gaming/comments/1d6n84z/even_jin_wants_in_on_bbl_drizzy/,,Even Jin wants in on bbl drizzy,,4,0
gaming,t3_1d6mny9,1717360386.0,/r/gaming/comments/1d6mny9/it_feels_like_a_mass_effekt_in_a_good_way/,,It feels like a Mass Effekt (in a good Way) .,"Is it just me or does Rogue Trader fells like you play a Mass Effekt Game but Warhammer 40k. 

I Love it 😍",83,142
gaming,t3_1d6mi53,1717359958.0,/r/gaming/comments/1d6mi53/i_found_my_old_playstation/,,I found my old Playstation!,,178,4259
gaming,t3_1d6me8u,1717359668.0,/r/gaming/comments/1d6me8u/favorite_game_fallout_skyrim_or_havent_played/,,"Favorite game: Fallout, Skyrim or Haven't played either. No secret option D. ","EDIT: ELDER SCROLLS SERIES VS FALLOUT SERIES

Which game is your favorite and why? 

All other games being irrelevant.",40,0
gaming,t3_1d6l51h,1717356342.0,/r/gaming/comments/1d6l51h/xbox_one_s_buddy_has_an_issue_with_overwatch_2/,,[Xbox one S] Buddy has an issue with Overwatch 2 not working. ,"He says it’s won’t install, but he says it’s stuck in his Game Library as if It was installed. When he goes to install it, it says “Installation stopped” t’s not been working for for about a year. He says when he tries to open it, it says Wrong version and to install and reinstall, which he’s done and nothing.

He’s reset is xbox (Duh), he’s deleted cashe, he’s uninstalled the OW2 on the library and it just comes back, he’s done just about everything we can think about. 

If anyone here has had this issue before AND FIXED IT, help would be appreciated.",20,0
gaming,t3_1d6hx2r,1717347907.0,/r/gaming/comments/1d6hx2r/can_you_people_suggest_me_some_good_full_game_ost/,,Can you people suggest me some good full game OST?,"I like listening OST while working. They actually made me relax and more focused too so I can be more efficent. I also listen them while writing my own stories and fictions. 

Currently my list has Doom Ethernal, Red Alert 2, The Messenger, Hades, Warhammer 40K Space Marines, Gun Game, Cup Head and Shovel Knight. I want to extend my list so I wont go back same OST's over and over again

Please keep in mind that OST should not inculde too many song with lyrics. Because they are distracting and throw my focus out the window. I am looking forwarf tou your suggestions :)",1734,499
gaming,t3_1d6hktg,1717346981.0,/r/gaming/comments/1d6hktg/i_never_realized_how_much_of_a_cozy_comfort_game/,,"I never realized how much of a cozy, comfort game the two original God of War games were to me until recently and, after beating them, I need more.","It's getting chilly here in my country and I got sick, so I've been working from home the entire week. Normally one hour before work day starts I've been playing the first two God of War games with a cup of coffee while under the blankets and these have been the best mornings I had the entire year. But I've beaten these games so many times when I was a kid that I already beat both, and the other PS1-2 era games I have don't really hit the same so... please recommend me your comfort childhood games so I can keep my early morning cozy gaming sessions going!",38,28
gaming,t3_1d6h349,1717345601.0,/r/gaming/comments/1d6h349/final_fantasy_vii_rebirth_combat_director_wants/,,"Final Fantasy VII Rebirth Combat Director Wants Final Part To Offer Players ""Even More Freedom""",,388,1419
gaming,t3_1d6h2il,1717345555.0,/r/gaming/comments/1d6h2il/voice_chat_ghost_of_tsushima_problem/,,Voice chat Ghost of Tsushima problem,"So recently I bought Ghost of Tsushima on pc and I play it with my friends (who's on ps5). The issue is that the voice chat is really bad, like he hears me like in other games, normal, but it's not the same for me

Is it a problem only computer players have, or is it just me ?",9,0
gaming,t3_1d6gyr5,1717345272.0,/r/gaming/comments/1d6gyr5/wtfwhat_lobby_is_this/,,"Wtf,what lobby is this",,11,0
gaming,t3_1d6glte,1717344292.0,/r/gaming/comments/1d6glte/twinstick_kill_knight_demo_recently_dropped_give/,,twin-stick Kill Knight demo recently dropped. Give it a try if you’re into arcade shooters. I think it’ll end up being one of the best in the genre personally,,5,5
gaming,t3_1d6gkeo,1717344185.0,/r/gaming/comments/1d6gkeo/is_the_dead_cells_castlevania_dlc_work_picking_up/,,Is the Dead Cells Castlevania DLC work picking up?,"By work picking up I meant worth but you get it.

I've played the shit out of Dead Cells but it has been a two years or so.  I kinda want to do a replay from scratch but add on the Castlevania crossover part if it's any good.",16,0
gaming,t3_1d6fum1,1717342213.0,/r/gaming/comments/1d6fum1/games_with_the_best_longevity/,,Games with the best longevity ,"So I’m playing gta 5 and it got me realizing, this game came out over a decade ago and it’s still extremely relevant and prob amongst the top played games a decade in . What was some other games that also had great longevity long after its release?
",153,47
gaming,t3_1d6f032,1717339838.0,/r/gaming/comments/1d6f032/lf_suggestions_traffic_management_games/,,LF suggestions: Traffic management games.,Looking for suggestions. Games that have traffic management. I really enjoy City Skyline and Infraspace because i manage the traffic here very wel. Any other games i miss? :),24,13
gaming,t3_1d6et8n,1717339305.0,/r/gaming/comments/1d6et8n/looking_for_tecommendation/,,Looking for tecommendation,"In the past I have played a few games on hardcore (one life) mode which I really enjoyed because of the danger and the generally better, more supportive communities.

Diablo 2 and Diablo 2 Resurrected - mostly a really great and small community which I enjoyed a lot. 

WoW WOTLK addon-based hardcore - very small community.  Maybe a few hundred players total with 30-40 active at any given time.  Deaths were catastrophic (long time to rebuild characters) and the community was incredibly tight-knit. 

Unfortunately I cannot continue to dedicate the amount of time WoW can suck and I’m not really into the new Diablos.  I might be chasing a holy grail but are there any good games out there with a great hardcore community that I might enjoy?",7,0
gaming,t3_1d6daqd,1717334823.0,/r/gaming/comments/1d6daqd/xbox_series_s_vs_xbox_one_x_crossgen_faceoff_the/,,Xbox Series S vs Xbox One X - Cross-Gen Face-Off - The X Has Had Its Day (Digital Foundry),,4,0
gaming,t3_1d6d049,1717333882.0,/r/gaming/comments/1d6d049/what_split_screen_games_can_i_grind_through_with/,,What split screen games can I grind through with a friend in five hours or less? (On Xbox),"We’ve replayed castle crashers multiple times and r looking for something new, don’t really care how similar it is just something we can spend a night beating.

Thank you everyone for all the suggestions I’m definitely going to check out most of them! ",239,191
gaming,t3_1d6cbtd,1717331690.0,/r/gaming/comments/1d6cbtd/gotta_make_sure_to_check_everywhere_for_loot/,,Gotta make sure to check everywhere for loot (Starfield),,58,470
gaming,t3_1d6bjj0,1717328928.0,/r/gaming/comments/1d6bjj0/games_that_are_universally_liked_but_you_despise/,,Games that are universally liked but you despise,"
I am sure everyone here has tried a famously great game and hated it/ got bored and I am curious to know which are your biggest disappointment.

I 'll start: 

Final Fantasy 9, first of the series that I played, almost completed it, found out is not my genres.

Dragon age inquisition, tried this couple of years ago and let's just say that the combat system didn't age well. I dropped it before the end of the tutorial, might giving a second chance in the future.

Ori, found to hard to navigate the map, I didn't had the time to play it regularly and everytime I entered the game I was soon lost.

Assassin's creed Odissey, first of the series I played, found to be too repetitive and I was annoyed by the level barrier: there is no good reason why I should not be able to cut a guards troath from behind his back just because my level is too low.",327,0
gaming,t3_1d6a47r,1717323194.0,/r/gaming/comments/1d6a47r/what_game_should_i_play_on_my_ps5/,,What game should I play on my ps5,"I really like single player adventure games. One of my favorite are red dead redemption 2, ghost recon wildlands and all the ac games. Now I'm a bit lost what i should play on my new ps5. I know this is a bit of a broad question. But maybe some of you now a good adventure game where you can explore and has a good story. I almost always play third person games but I'm also open for first person.",51,0
gaming,t3_1d69ydf,1717322505.0,/r/gaming/comments/1d69ydf/cod_zombies/,,COD zombies ,Can anyone please tell me about the whole COD zombies storyline. I tried to figure it out but failed. please start from scratch ,12,0
gaming,t3_1d68gw2,1717315927.0,/r/gaming/comments/1d68gw2/goty_new_category_for_best_dlc/,,GOTY: new category for best DLC ,"Throughout the last decade, the gaming market has shifted a lot towards downloadable content. Unfortunately, lots of DLCs are major cash grabs, without bringing anything new to the table. However, many games have invested a ton of energy, resources and creativity to develop something memorable

  
A few examples that deserve praising are: Blood and Wine (Witcher 3), Shadowbringers (FFXIV), Phantom Liberty (Cyberpunk 2077) and hopefully Shadow of the Erdtree (Elden Ring)

  
Do you think there should be a new category for ""Best DLC"" at GOTY awards? This could be a way to incentivize non-predatory DLCs.",28,0
gaming,t3_1d68dph,1717315531.0,/r/gaming/comments/1d68dph/which_gaming_protagonist_couldnt_you_warm_up_to/,,Which gaming protagonist couldn’t you warm up to?,Discuss,1766,1962
gaming,t3_1d688gk,1717314896.0,/r/gaming/comments/1d688gk/i_have_50_bucks_and_two_options/,,I have 50 bucks and two options,"I’ve got a ps5 and 50 bucks to spend. Ive got two potential carts of games to buy. One has burnout paradise, outlast, and cyberpunk. The other has burnout and outlast, but also hifi rush and mass effect trilogy. (Ive already played the trilogy on 360) which do I pick?",24,0
gaming,t3_1d6865y,1717314618.0,/r/gaming/comments/1d6865y/santa_monica_studios_intentionally_ruined_kratos/,,Santa Monica Studios Intentionally Ruined Kratos,Thoughts on this video about GOW 2 & 3?,22,0
gaming,t3_1d66lb6,1717308010.0,/r/gaming/comments/1d66lb6/simple_questions_sunday/,Weekly Simple Questions Thread,Simple Questions Sunday!,"For those questions that don't feel worthy of a whole new post.

This thread is posted weekly on Sundays (adjustments made as needed).",37,0
gaming,t3_1d65jwr,1717303848.0,/r/gaming/comments/1d65jwr/if_you_waited_until_you_beat_every_game_in_your/,,"If you waited until you beat every game in your collection for the first time at least once (on ""normal"" Any% ""Glitchless"" difficulty) before you bought a new game, how long would you be waiting before your next purchase, and how incentivized would you be to work through your backlog?",Title,28,0
