subreddit,id,timestamp,permalink,tag,title,body,comments,score
gaming,t3_1d5ezb8,1717216642.0,/r/gaming/comments/1d5ezb8/what_game_shocked_you_by_breaking_gaming/,,What game shocked you by breaking gaming conventions or the fourth wall?,"The first game that broke the fourth wall for me was Metal Gear Solid with the controller switch in the Psycho Mantis battle. Seeing Ganon’s health bar go off the screen in TOTK stunned me, but the one that actually terrified me was the first boss battle in Dead Space 2 where he dies and drops an item. As I went to pick it up he roared back to life, breaking thirty years of gaming convention and scaring me senseless. Good times. :)",356,443
gaming,t3_1d5etvk,1717216112.0,/r/gaming/comments/1d5etvk/characters_with_negative_stat_growth/,,Characters with negative stat growth?,"I'm playing Eiyuden Chronicle: Hundred Heroes, and you can recruit a few very old, very seasoned allies. This got me thinking, have there ever been characters with negative stat growth? Maybe they're old, or sick. I don't mean the rest of the game outpaces them or there are hidden mechanics resulting in a net loss, I mean a gross loss. Level up, -5 max HP type stuff.",25,3
gaming,t3_1d5ekzn,1717215216.0,/r/gaming/comments/1d5ekzn/what_games_actually_do_the_living_breathing_open/,,"What games actually do the ""living, breathing"" open world right? ",So many open world games out there but which ones actually provide an unparalleled level of immersion and simulation? ,1560,2974
gaming,t3_1d5ehp5,1717214910.0,/r/gaming/comments/1d5ehp5/what_game_are_you_a_certified_veteran_in/,,What Game Are You A Certified Veteran In?,Me and my friends hop on Battlefield 4 every few months and every game we play we always get ace squad ribbon without fail. Anyone else have a game that's burnt into their bones?,612,176
gaming,t3_1d5ed0n,1717214509.0,/r/gaming/comments/1d5ed0n/did_someone_ever_had_that_holy_shit_this_dev_made/,,"Did someone ever had that ""Holy shit this dev made THAT game???"" Moment?","Now, I'm a really spacey person.

Normally when I play a game I don't pay attention to the name of the deve that much.

And this Led to moments like this happening several times.

One of the most recent ones was when I was playing another crab's treasure and I was like ""damn these devs are good, hope they have a good run"".

Badly did I know that Aggro crab (the devs) had made several games prior, games mind you that I really enjoyed. ",481,672
gaming,t3_1d5dvmj,1717212844.0,/r/gaming/comments/1d5dvmj/real_game_for_real_chads/,,Real game for real chads,,81,249
gaming,t3_1d5dc3f,1717210954.0,/r/gaming/comments/1d5dc3f/esdf_vs_wasd/,,ESDF vs WASD,"First, what's your favourite movement keys and why aren't they ESDF?

Second, considering both key groupings have been around since OG Castle Wolfenstein, and considering consoles have offered multiple easily selectable controller preferences since the 90s as well, why do modern devs simply have an easy way to select ESDF or WASD rather than considering WASD as the only option?

Where's this question coming from? After recently trying a game on PC where you simply could not change keybinds to anything other than WASD, I simply noped out as there is no way I'm reprogramming nearly 25 years of gaming muscle memory. It then struck me how odd it is that console games have been offering an easy way to choose alternative stick/d-pad/trigger setups for ages yet PC devs are apparently blind to the idea.",43,0
gaming,t3_1d5d2km,1717210059.0,/r/gaming/comments/1d5d2km/i_thought_this_was_a_made_up_joke/,,I thought this was a made up joke,,1083,8091
gaming,t3_1d5c9zn,1717207366.0,/r/gaming/comments/1d5c9zn/are_there_any_other_fun_games_like_re7_on_pc/,,Are there any other fun games like RE7 on PC?,"I know this will sound strange but I bought and started playing RE7 on PC today and I found it to be quite fun. I haven’t played a game on my computer in a while that wasn’t Minecraft and I want to start playing more FPS-survival esque games.

Please suggest games that aren’t resident evil.",13,0
gaming,t3_1d5b1h4,1717203345.0,/r/gaming/comments/1d5b1h4/after_playing_fallout_nv_for_more_than_30_hours_i/,,"After playing Fallout: NV for more than 30 hours,  I just discovered that the Pip Boy has a flashlight feature and that you can block attacks. ","Spoilers ahead: I struggled so hard in dark rooms especially in the Bright Brotherhood area that I literally said “Man this game should have a flashlight item somewhere down the line, but I guess that’s what the cateye pills are for”. Then while fighting some guards at the Ultra-Luxe, I pressed the pip boy button for too long and poof, the flashlight worked. Then I gave veronica a dress worn by the guards and she taught me a move that required me to block, and I was like “what the hell you can block attacks??” And that’s where I learned about both of those basic actions.

Have you guys experienced something like this where you have no idea about the most seemingly basic actions in the game that you just gave up knowing just to find out about them after you’re a handful of hours playing in? Share your experiences below!

Edit: I just want to add this cause you guys might not know, but if you have an enemy that throws a grenade/bomb, before they throw it, shoot the grenade/bomb in their hand via the VATS mode(where you can choose what part of their body to target) and it will explode on them instead. Most times it kills them instantly, if not they’ll be severely crippled that you can kill them with ease anyways. Just a very nice tip that makes the game so much easier.",339,2542
gaming,t3_1d5atpz,1717202674.0,/r/gaming/comments/1d5atpz/what_are_some_easy_or_laid_back_video_games_from/,,"What are some easy or laid back video games from the NES, SNES or later consoles?","My friend recently got a console that lets him play either game type on it via the two cartridge ports on it. But, while he is a huge Mario fan, I myself have never really been into them (and never played many retro games. I grew up on PS1 onwards). It’s mainly the platforming that’s my Achilles heel. Never been good at it and use up all my lives within a few minutes, before I get frustrated and turn it off. 

So I’m wondering if there are any games out there that are more relaxed. Calm. You can take your time with them and explore. Obviously not an open world game like we’re used to now, but close enough. So anything from the aforementioned consoles or even stuff from the 2000s and before. 

Any suggestions y’all can recommend I’ll look into. ",83,10
gaming,t3_1d5atb3,1717202638.0,/r/gaming/comments/1d5atb3/still_legally_distinct/,,Still legally distinct,,5,46
gaming,t3_1d5agk2,1717201536.0,/r/gaming/comments/1d5agk2/my_geralt_is_such_an_artiste_witcher_3/,,My Geralt is such an Artiste! (Witcher 3),,12,48
gaming,t3_1d5aexb,1717201398.0,/r/gaming/comments/1d5aexb/chilvary_2_free/,,Chilvary 2 Free,Chilvary 2 is free on EPIC Games store right now. Usually it's crappy games for free. 64 player online midevil FPS sounds pretty damn fun though!,139,379
gaming,t3_1d5a2vv,1717200370.0,/r/gaming/comments/1d5a2vv/what_are_some_good_free_to_play_pc_games_to_allow/,,What are some good free to play PC games to allow us to test the hardware of our games without spending money?,"I only buy gaming laptops because I don't have money or space for a PC setup. So far, they have never been up to the standards I'd expect a gaming platform to perform at, always having to look up how to optimize my computer to play games well. People would even say that the games do that for you, but not from my experience.

I just got my current laptop on Black Friday 2023, so it's pretty new, but have yet to buy games for it. My previous one had 3 Wolfenstein games on it and none played well. Doom 2016 was okay with some screen tearing, and the only game that played almost perfectly was Borderlands Pre-Sequel.",15,0
gaming,t3_1d59wsf,1717199906.0,/r/gaming/comments/1d59wsf/it_is_now_the_half_year_mark_whats_your_goty_so/,,"It is now the half year mark, whats your GOTY so far?",I can't stop playing Balatro and Last Epoch,170,0
gaming,t3_1d59uvn,1717199743.0,/r/gaming/comments/1d59uvn/if_you_had_to_strictly_vote_between_john_henry/,,"If you had to strictly vote between John Henry Eden from Fallout 3, Senator Armstrong from Metal Gear Rising or the player from Saint’s Row 4, who would you choose and why?","Im going with the player from Saint’s Row 4, safest bet ",11,0
gaming,t3_1d59do5,1717198332.0,/r/gaming/comments/1d59do5/time_to_push_the_ps5_to_its_limits/,,Time to push the ps5 to its limits,,171,1313
gaming,t3_1d57usb,1717193972.0,/r/gaming/comments/1d57usb/what_songs_and_themes_give_you_ptsd_from_games/,,what songs and themes give you PTSD from games? ,Ex: Only you - farcry 5,25,0
gaming,t3_1d57lmw,1717193286.0,/r/gaming/comments/1d57lmw/tomba_special_edition_announced_forgotten_classic/,,Tomba: Special Edition announced - forgotten classic from Ghosts 'n Goblins creator!,,49,173
gaming,t3_1d57g66,1717192878.0,/r/gaming/comments/1d57g66/gta_6_publisher_addresses_lack_of_pc_news_stating/,,"GTA 6 publisher addresses lack of PC news, stating Rockstar ""will make more announcements in due time""",,62,241
gaming,t3_1d570s1,1717191739.0,/r/gaming/comments/1d570s1/which_army_would_you_rather_fight_the_flood_from/,,"Which army would YOU rather fight; The Flood from Halo, or The Combine from Half-Life?","Been playing back through the Half-Life series recently and it dawned on me that these two armies are pretty similar to each other, they both have the ability to turn people into zombies and most of their technology comes from other civilizations. So if they were real, which one would you rather fight? The Flood is incredibly difficult to eradicate because a single spore could escape to start building numbers again but on the other hand The Combine has a bunch of large vehicles like the Striders and Gunships that are tough to kill and can do a lot of damage before they're taken down.",336,370
gaming,t3_1d56ve4,1717191325.0,/r/gaming/comments/1d56ve4/what_are_things_devs_added_to_a_game_without/,,What are things devs added to a game without thinking much about it but fans interpreted it with a deep meaning or a theory different to what the devs thought? ,"In Zelda Majora's Mask the Happy Mask Salesman tells Link ""You've meet with a terrible fate haven't you?"". For a long time fans were speculating he was referring to Links (supposed) death. 
But in an interview with the devs on of them revealed that they added lines in the game about how they felt about making the game and that particular line was referring to the pressure they were experiencing for making the game in a short time span. ",220,1182
gaming,t3_1d56apo,1717189794.0,/r/gaming/comments/1d56apo/most_final_bosses_are_nerfed_before_players_are/,,"Most final bosses are nerfed before players are allowed to play as them. What's a case of the opposite, where a final boss becomes even more overpowered in the hands of a player?","I feel like the classic example of this is Vergil from the Devil May Cry games, and specifically Devil May Cry 5. It kind of feels like Vergil isn't really taking the fight seriously, at least on normal difficulty, which is what I played the game on. But when you play as him? OMG, the enemies just start dropping like flies.",475,2583
gaming,t3_1d5604s,1717189029.0,/r/gaming/comments/1d5604s/taketwo_is_quietly_killing_private_division/,,Take-Two Is Quietly Killing Private Division,,1,14
gaming,t3_1d55qe3,1717188305.0,/r/gaming/comments/1d55qe3/a_good_game_but_unfortunately_a_victim_of_its_own/,,A good game but unfortunately a victim of its own company overrated promotion.,"I only played Watch_Dogs for the first time last year without high expectations and enjoyed it, I think Ubisoft kept the hype for the game very high with the E3 trailer and by trying to make it a GTA rival, in the end this was very bad for the game's reputation since many people became disappointed with what they got.",95,214
gaming,t3_1d552d9,1717186563.0,/r/gaming/comments/1d552d9/travel_4player_split_screen_setup/,,Travel 4-player split screen setup,JSAux FlipGo 13 inch. ,17,94
gaming,t3_1d536mm,1717181711.0,/r/gaming/comments/1d536mm/so_i_came_across_a_random_review_of_the_sims_2_on/,,So I came across a random review of the Sims 2 on PSP and apparently this game was an acid trip. Anyone try it back-in-the day.,"Unlike the console games the PSP version had a story focus.

The main plot involves your car breaking down outside of a town that's actively invaded by the undead (which you can fight off with a shovel for money), infiltrating a bovine cult in order to do a line-dance summoning of their giant evil cow, forging an id for a (literal) alien so he can get some beer, and a mad scientist reverse engineering the plum-bob to control your characters wants/desires to make you work for him.",26,60
gaming,t3_1d52w6i,1717180962.0,/r/gaming/comments/1d52w6i/at_what_point_is_it_okay_to_google_the_answer/,,At what point is it okay to Google the answer?,I'm honestly stuck.,104,0
gaming,t3_1d52kwc,1717180168.0,/r/gaming/comments/1d52kwc/what_game_had_the_most_emotional_impact_on_you/,,What game had the most emotional impact on you?,For me I can list three games the original FFVII that game was so gangster in its day The Last of Us anf the one that hit me the hardest The walking dead telltale games,468,161
gaming,t3_1d52h0s,1717179885.0,/r/gaming/comments/1d52h0s/silhouette_design_is_extremely_important_to/,,Silhouette design is extremely important to multiplayer games and TF2 CRIT it.,,77,1003
gaming,t3_1d51dct,1717177030.0,/r/gaming/comments/1d51dct/recomand_me_hidden_single_player_gems_i_am_on_pc/,,Recomand me hidden single player gems (i am on pc),Tittle ,27,0
gaming,t3_1d50nt4,1717175204.0,/r/gaming/comments/1d50nt4/can_anyone_help_me_recall_the_name_of_an_old_2128/,,Can anyone help me recall the name of an old 21-28 year old PC shooter game?,"Does anyone remember the title of a 3D sci-fi top down shooter where you control a robot and used ‘numpad+’ and ‘numpad enter’ to aim up and down? I think the movement was also done on the keypad numbers.

I played it on PC (95% sure it did not need DOS to run).

I thought its name was similar to ""DiViDe"" but I can not seem to find anything with that name, I remember that either V or I on the cover was stylized as a long beam of light coming from some kind of entrance IIRC, dominant color on the cover was black. The game was likely a pirated copy from a stadium so the original cover could have been different.

The intro cutscene also depicted a large octahedron shaped ship coming towards a planet I think.

IIRC the first levels gave me the vibes of metal world maps from Total Annihilation (the controlled character looked similar to the ACUs).

I do not remember any human voiceovers throughout the gameplay either, I am guessing the plot was just some text in the manual a’la doom plot which I did not own with the pirated copy, it was raw, pure arcade-like shooter.",19,4
gaming,t3_1d50c64,1717174422.0,/r/gaming/comments/1d50c64/what_technically_and_artistically_speaking_is_a/,,"What, technically and artistically speaking, is a 'Warioland'-like?","I have heard the term to describe games such as *Pizza Tower* - and I love these - but I've never seen anything that would have come close to an actual definition of this assumed genre. 

Just like there are 'Soulslikes', and, possibly, even 'Hotline Miami-likes', 'Warioland-likes' still seem to somewhat defy further definition. ",16,0
gaming,t3_1d4zo9q,1717172735.0,/r/gaming/comments/1d4zo9q/any_good_bird_flight_sims/,,Any good bird flight sims? ,"I think birds have really cool movement and it would be cool to play a game where I can fly and dive and stuff.

I saw a bird fly the other day and it closed its wings to fall while going forward then opened its wings again and it was awesome, I wanted to do that.

I want manual wing flapping and being able to dive and pitch and tilt",19,12
gaming,t3_1d4z9cx,1717171677.0,/r/gaming/comments/1d4z9cx/does_anyone_know_of_any_good_online_cozy_games/,,Does anyone know of any good online cozy games for Xbox/PC?,I'm wanting to find like some cozy MMO where I can play with friends. Does anyone have suggestions?,24,0
gaming,t3_1d4yr16,1717170380.0,/r/gaming/comments/1d4yr16/dragons_dogma_2_may_31st_patch_introduces_nvidia/,,"Dragon's Dogma 2 May 31st Patch Introduces NVIDIA DLSS 3 Frame Generation, Increased Item Storage Space and More",,18,52
gaming,t3_1d4ypnf,1717170281.0,/r/gaming/comments/1d4ypnf/every_plot_twist_in_an_arkham_game/,,Every plot twist in an Arkham game,,63,1190
gaming,t3_1d4ylfi,1717169978.0,/r/gaming/comments/1d4ylfi/concord_might_have_the_ugliest_characters_designs/,,Concord might have the UGLIEST Characters Designs I have ever seen.,,2239,13219
gaming,t3_1d4w4uy,1717163520.0,/r/gaming/comments/1d4w4uy/is_there_a_single_player_coop_option_to_a/,,Is there a single player / coop option to a grid-inventory game?,"More or less the title. 

I’ve been feeling a game like Marauders but without the pvp. The more i’ve thought about it, a game like darkest dungeon (1) has something like this, so it doesn’t have to be an extraction-like. 

Feels like stalker 2 is likely the best fit here, but its not available yet. 

Any suggestions? ",17,9
gaming,t3_1d4v46h,1717160647.0,/r/gaming/comments/1d4v46h/hades_2_gets_1_million_views_on_a_song_only_weeks/,,Hades 2 gets 1 million views on a song only weeks after early access,"https://youtu.be/N7QSavYWEE0

**SPOILER WARNING**. The song reveals a lot about boss in the game, be warned as it was great to experience it first hand.

Must be some kind of record I imagine.    Either their sales are through the room or the same early access fans are playing that song 20 times a day

",92,832
gaming,t3_1d4ubbr,1717158172.0,/r/gaming/comments/1d4ubbr/minecraft_real_world_cities_st_george_hurricane/,,"Minecraft Real World Cities - St. George, Hurricane, Ivins, Cedar City and Zion National Park (SW Utah, USA) - 1:3 scale - 46k",https://www.planetminecraft.com/project/real-world-cities-st-george-hurricane-ivins-cedar-city-and-zion-national-park-sw-utah-usa-1-3-scale-46k/,12,80
gaming,t3_1d4u16f,1717157262.0,/r/gaming/comments/1d4u16f/what_other_games_have_this/,,What other games have this?,"In Mega Man you can select the levels / bosses in each order you like, I was trying to think of other games that have this featured. But couldn't think of any, do you know other games that has this or similar feature?",33,4
gaming,t3_1d4u0og,1717157214.0,/r/gaming/comments/1d4u0og/dark_souls_3_fanart_done_by_me/,,Dark Souls 3 FanArt done by me,Hope you guys enjoy it,30,468
gaming,t3_1d4t7n6,1717154426.0,/r/gaming/comments/1d4t7n6/f_r_i_g_h_t_e_n_e_d/,,F r i g h t e n e d,,3,44
gaming,t3_1d4sxay,1717153365.0,/r/gaming/comments/1d4sxay/the_sims_4_is_launching_battle_passstyle_timed/,,"The Sims 4 Is Launching Battle Pass-Style Timed Events, and Fans Aren't Happy",,491,4129
gaming,t3_1d4rqtz,1717148568.0,/r/gaming/comments/1d4rqtz/is_console_gaming_starting_to_die_out/,,Is console gaming starting to die out?,"It's pretty easy to see that the 7th and 8th generations of console gaming were the peak eras of console gaming.

But with the latest 9th gen consoles, it really doesn't seem like much exciting stuff has happened at all.

Now yes, everyone can quickly go ahead and say that it's because both the PS5 and the Xbox Series X/S had rough start due to COVID. But it's more than just that.

Sony has now started to introduce their exclusive titles on to the PC platform. However they still get crapped on for their ridiculous anti-consumer practices. Including the requirement of a PSN account on PC.

And as for Microsoft, it doesn't seem like they care about their consoles anymore. But rather they're more focused on cloud gaming with their Xbox game pass service. And then there's the recent controversy of them shutting down several studios because they couldn't make them quick money despite the success.

Also another reason seems to be the pricing. Consoles have gotten really expensive and so have their accessories. And the games have gotten pretty expensive that people would rather prefer to play on PC while waiting for a discount to appear on steam or just straight up pirate the game.

But what do you think? What will be the future of console gaming?
",95,0
gaming,t3_1d4r4rt,1717145985.0,/r/gaming/comments/1d4r4rt/found_some_gems_in_my_old_room/,,Found some gems in my old room,,120,1062
gaming,t3_1d4r2ow,1717145706.0,/r/gaming/comments/1d4r2ow/video_game_pre_orders_without_requirement/,,Video game pre orders without requirement specifications,"I was wondering how everyone feels about being able to pre order a game without being able to see the hardware you need to run it.

I have noticed for at least the past few months a few games having store pages that have requirements TBD. It's not the biggest issue, but it still bothers me to a degree. God of War is the current one and I believe Ghost of Tsushima was the same way.

I understand both of these games are on ps4 and ps5 so you just need hardware comparable to that, but what is to stop publishers from doing it to new releases across platforms?

Edit: I hardly ever pre order games anymore. I only do so from devs that have earned it. I think the last game I pre ordered was Elden Ring. This is mostly just something I have noticed that bugs me about store pages and pre ordering.",23,10
gaming,t3_1d4qkif,1717143409.0,/r/gaming/comments/1d4qkif/shooter_fans_what_game_got_you_interested_in_the/,,Shooter fans: What game got you interested in the genre? ,"I gamed on Nintendo consoles as a kid (N64, GameCube, and Wii). I played Call of Duty 3 on the Wii with the awkward Wiimote controls and fell in love with the shooter genre. I ditched the Wii and its “kiddie” games and got a PS3 to play shooters and other action games. 

Today I mostly play on PC. I’m 31 now and can see myself playing shooters for life. Single player and co-op are my favorite ways to play. 

How about you? ",152,27
gaming,t3_1d4qi17,1717143101.0,/r/gaming/comments/1d4qi17/had_a_little_problem_with_my_hellpod/,,Had a little problem with my hellpod,,2,1
gaming,t3_1d4qar8,1717142219.0,/r/gaming/comments/1d4qar8/name_one_fictional_character_you_think_you_could/,,Name one fictional character you think you could confidently beat the living hell out of in a fight barehanded," Robert House from Fallout New Vegas, I’m boxing that skinny cyborg dude unless it’s him in his prime ",780,431
gaming,t3_1d4q20o,1717141107.0,/r/gaming/comments/1d4q20o/can_i_play_ragnarok_offline_when_it_comes_out/,,Can i play ragnarok offline when it comes out?,"Hello everyone , so I've seen god of war ragnorok come out on steam 3 month  from now and well somy being sony are forcing psn on a single player game. Its not really a big issue for me as i was a ps4 owner so i have a psn account. My only issue is if i will be forced to always be online to play the game or am i able to run it with no internet when i travel or something.",8,0
gaming,t3_1d4pjjg,1717138890.0,/r/gaming/comments/1d4pjjg/nowhere_else_does_a_95_chance_feel_so_low/,,Nowhere else does a 95% chance feel so low,,175,3324
gaming,t3_1d4p8o3,1717137611.0,/r/gaming/comments/1d4p8o3/games_that_dont_require_heavy_use_of_a_mouse/,,Games that don't require heavy use of a mouse?,"Hello fellas

I have a friend who fucked up a few fingers on her right hand, and as a result of this she cannot really use her mouse much. This upsets her heaaavy

She plays overwatch the most the most, but she also likes rhythm games (osu, project sekai..)

She plays limbus company sometimes as well as Roblox.

She dislikes strategy games I believe.

Would you fellas be willing to give some recommendations for (preferably coop, although singleplayer is ok) games that wouldn't require heavy use of her mouse?

Would be nice if they are free, although if it's under 10€ I'll take it

Oh and she likes hello kitty and Miku (vocaloid in general) a lot and cute things as well so if there are any games like that that would be very cool, although it's not a requirement 

Thank you very much in advance gamers :)
",61,7
gaming,t3_1d4p0gy,1717136638.0,/r/gaming/comments/1d4p0gy/have_you_ever_taken_a_days_off_work_because_of_a/,,Have you ever taken a day(s) off work because of a video game release? If so which one?,Personally I haven't but I'm hoping to if DA:4 drops this year,1337,584
gaming,t3_1d4onnt,1717135212.0,/r/gaming/comments/1d4onnt/free_talk_friday/,Weekly Free Talk Thread,Free Talk Friday!,"Use this post to discuss life, post memes, or just talk about whatever! 

This thread is posted weekly on Fridays (adjustments made as needed).",46,0
gaming,t3_1d4lzn1,1717125557.0,/r/gaming/comments/1d4lzn1/shadow_of_the_tomb_raider_still_looks_fantastic/,,Shadow of the Tomb Raider still looks fantastic these days. ,Grew up playing Prince of Persia/Sands of Time and the recent Tomb Raiders have really scratched that itch,114,363
gaming,t3_1d4l6ur,1717122933.0,/r/gaming/comments/1d4l6ur/boltgun_secret_episodes/,,Boltgun secret episodes,how exactly am I supposed to unlock the secret episodes in boltgun ans what do I get if i unlock the game?,8,0
gaming,t3_1d4l0pr,1717122385.0,/r/gaming/comments/1d4l0pr/bad_luck_tendencies/,,Bad Luck Tendencies ,Does anyone have a typical type of bad luck when it comes to gaming ?  Mine is when I start and finish an older game that’s iconic for the first time it gets some remaster almost right after. Theres a handful where after years of never playing then finally starting and completing it gets some remastered or enhanced port right after.,11,0
